{
  "station": "05_copy",
  "scores": {
    "commercial": 4,
    "handoff": 4.0,
    "craft": 5.0,
    "benchmark": 3
  },
  "total": 4.1,
  "notes": [
    "商业价值 4/5：中英两版可直接粘贴，句句带来源；但没有 ja/ko，也没做 A/B 文案",
    "衔接 4.0/5：6/6 项 QA 通过；schema=缺；sha 校验=是",
    "工艺 5.0/5：QA 通过率 6/6",
    "标杆 3/5：无已验证翻译工具，人工撰写优于机翻；对标 DeepL+人工 仍差一档"
  ]
}
