{
  "station": "00_brief",
  "scores": {
    "commercial": 4,
    "handoff": 5.0,
    "craft": 5.0,
    "benchmark": 4
  },
  "total": 4.5,
  "notes": [
    "商业价值 4/5：一句话就被拆成可执行的交付清单；但语言只留 zh/en，ja/ko 未定",
    "衔接 5.0/5：4/4 项 QA 通过；schema=是；sha 校验=是",
    "工艺 5.0/5：QA 通过率 4/4",
    "标杆 4/5：jq 是 JSON 处理的基准工具；本机 1.7.1 实测通过"
  ]
}
